{
  "schema": "source-receipt-1",
  "url": "https://example.org/datasets/prices-2026-10-01.csv",
  "retrievedAt": "2026-10-13T04:10:00Z",
  "publishedAt": "2026-10-01T00:00:00Z",
  "publisher": "Example Dataset Service",
  "sourceType": "DATASET",
  "contentSha256": "222b5c6aa934372dc09c6420241a2d13e4691094fdde9d0e9947316bd92d7b88",
  "contentType": "text/csv",
  "savedAs": "data.csv",
  "excerpt": "id,sku,price — 3 rows (A-100, B-200, C-300)",
  "role": "SUPPORTS"
}
